{"schema_version":1,"project":"private-vm","release_tag":"v0.1.0-rc.1","kind":"deb","artifact":"private-vm_0.1.0-rc.1_linux_amd64.deb","size_bytes":1024,"sha256":"sha256:aaaaaaaaaaaaaaaaaaaaaaaaaaaaaaaaaaaaaaaaaaaaaaaaaaaaaaaaaaaaaaaa","sbom":"deb.sbom.spdx.json","sbom_sha256":"sha256:bbbbbbbbbbbbbbbbbbbbbbbbbbbbbbbbbbbbbbbbbbbbbbbbbbbbbbbbbbbbbbbb","source_repository":"StevenBuglione/private-vm","source_commit":"cccccccccccccccccccccccccccccccccccccccc","source_ref":"refs/tags/v0.1.0-rc.1","workflow":".github/workflows/release.yml","architecture":"amd64","os":"linux"}
